2021-01-14 07:52:40.695999,Magnam ut numquam neque.,0,False
2021-01-14 07:53:40.695999,Numquam aliquam non magnam modi tempora.,1,True
2021-01-14 07:54:40.695999,Etincidunt quaerat ipsum etincidunt modi neque.,2,False
2021-01-14 07:55:40.695999,Neque amet ut dolore sit velit labore etincidunt.,3,True
2021-01-14 07:56:40.695999,Amet sed aliquam eius dolorem porro eius.,4,True
2021-01-14 07:57:40.695999,Adipisci adipisci dolore velit quiquia dolor dolore neque.,5,False
2021-01-14 07:58:40.695999,Voluptatem magnam dolorem dolore sit aliquam non.,6,True
2021-01-14 07:59:40.695999,Etincidunt dolor sed dolore sed.,7,False
2021-01-14 07:60:40.695999,Sit porro dolorem eius porro non ut.,8,True
2021-01-14 07:61:40.695999,Est ut amet dolore neque dolorem etincidunt neque.,9,False
